{
  "$schema": "https://json-schema.org/draft/2020-12/schema",
  "$id": "https://autobuild.local/schemas/validation.schema.json",
  "title": "Validation results",
  "description": "runs/<run-id>/validation/results.json. Authoritative only when producer is 'controller' (the controller re-ran the commands itself); results reported by the implementer are supplemental.",
  "type": "object",
  "additionalProperties": false,
  "required": ["schema_version", "run_id", "producer", "commands"],
  "properties": {
    "schema_version": { "const": 1 },
    "run_id": { "type": "string", "minLength": 1 },
    "producer": { "enum": ["controller", "implementer"] },
    "commands": {
      "type": "array",
      "items": {
        "type": "object",
        "additionalProperties": false,
        "required": ["name", "kind", "command", "exit_code", "started_at", "duration_seconds"],
        "properties": {
          "name": { "type": "string", "minLength": 1 },
          "kind": { "enum": ["setup", "test", "lint", "typecheck", "build", "browser", "other"] },
          "command": { "type": "string", "minLength": 1 },
          "cwd": { "type": "string" },
          "exit_code": { "type": ["integer", "null"] },
          "status": { "enum": ["passed", "failed", "timed_out", "error", "skipped"] },
          "required": { "type": "boolean" },
          "detail": { "type": "string" },
          "stdout_path": { "type": "string", "minLength": 1 },
          "stderr_path": { "type": "string", "minLength": 1 },
          "passed": { "type": "integer", "minimum": 0 },
          "failed": { "type": "integer", "minimum": 0 },
          "skipped": { "type": "integer", "minimum": 0 },
          "log_path": { "type": "string", "minLength": 1 },
          "started_at": {
            "type": "string",
            "pattern": "^\\d{4}-\\d{2}-\\d{2}T\\d{2}:\\d{2}:\\d{2}(\\.\\d+)?(Z|[+-]\\d{2}:\\d{2})$"
          },
          "duration_seconds": { "type": "number", "minimum": 0 }
        }
      }
    }
  }
}
